id,question,A,B,C,D,E,answer,category,macro category
2938,il codice deontologico nell'esprimersi su pratiche mediche definite non convenzionali puntualizza alcuni principi. tutti i seguenti sono previsti nel codice deontologico tranne: (art.15 cdm 2014),il medico che le pratica ne prende diretta e non delegabile responsabilità professionale,qualsiasi terapia non convenzionale non deve sottrarre al cittadino a trattamenti di provata efficacia,per effettuare terapia non convenzionale bisogna essere autorizzati dall'ordine dei medici,qualsiasi terapia non può sottrarre dall'applicazione del consenso,e' vietato per un medico collaborare con chi esercita abusivamente la professione anche nel settore delle cosiddette pratiche alternative,C,Area Preclinica 2016,prevenzione e deontologia medica
2940,il medico deve astenersi dall'ostinazione in trattamenti non proporzionati (art. 16 cdm 2014),quando non si possono attendere benefici per la salute e/o miglioramenti della qualità della vita,quando i trattamenti sono eccessivamente costosi,quando gli effetti collaterali dei farmaci non sono prevedibili,quando non vi è un pare positivo unanime nella parentela di i grado,quando le terapie prescrivibili sono di difficile reperimento,A,Area Preclinica 2016,prevenzione e deontologia medica
2944,"qualora si verificasse un contrasto tra le norme del codice deontologico e le norme interne all'ente da cui dipende ,il medico (art.68 cdm 2014)",deve chiedere l'intervento dell' ordine dei medici,deve chiedere l'intervento dell'ordine solo se dipendente da ente pubblico,non può rivolgersi all' ordine dei medici essendo vigenti le norme dell'ente,in attesa della soluzione della vertenza può sempre interrompere il servizio,è opzionale chiedere interventi esterni all'ente,A,Area Preclinica 2016,prevenzione e deontologia medica
3041,il compenso del medico (art.52):,deve essere subordinato ai risultati delle prestazioni effettuate,deve essere concordato preventivamente col paziente,deve rispettare i limiti minimi ma non i massimi stabiliti dall'ordine provinciale,il medico non può prestare gratuitamente la sua opera,le tariffe di ciascun medico devono essere pubblicate sul bollettino regionale,B,Area Preclinica 2016,prevenzione e deontologia medica
3076,la ricerca scientifica: (art.45),si avvale della sperimentazione sull'animale ma non sull'uomo,si avvale della sperimentazione sull'uomo ma non sull'animale,solo in laboratorio si avvale della sperimentazione sull'animale e sull'uomo,si avvale della sperimentazione,non si avvale della sperimentazione,C,Area Preclinica 2016,prevenzione e deontologia medica
3079,"il medico, alla morte del paziente, rispetto al segreto professionale (art. 10 del c.d.):",è tenuto ugualmente al segreto,può esimersi dal segreto solo per i familiari di primo grado,deve esimersi dal segreto per l'autorità giudiziaria,non è più tenuto al segreto,non più è tenuto al segreto solo per il figlio maggiore,A,Area Preclinica 2016,prevenzione e deontologia medica
3183,la ricetta medica ripetibile:,è compilata dal medico più volte,è valida per un anno,è sempre valida,è valida per non più di due volte,ha un periodo di validità di tre mesi,E,Area Preclinica 2016,prevenzione e deontologia medica
3219,i presidi ospedalieri sono:,tutti gli ospedali con almeno 150 posti letto,ospedali integrati alla usl ma con autonomia economico-finanziaria,ospedali in cui insiste la prevalenza del percorso formativo del triennio clinico della facolta' di medicina,ospedali gestiti da privati,ospedali di rilievo nazionale e di alta specializzazione,B,Area Preclinica 2016,prevenzione e deontologia medica
3227,tutte le seguenti affermazioni sull'epatite a sono esatte eccetto:,e' una tipica malattia a trasmissione feco-orale,le sorgenti di infezioni sono l'uomo e gli animali malati,"in italia, ci sono state epidemie anche recenti che hanno interessato soprattutto la puglia","i principali fattori di rischio per la malattia sono il consumo di mitili, i viaggi, il contatto con altri casi o con acqua contaminata","non esistendo alcun vaccino, la principale prevenzione consiste nell'attuazione di norme igieniche generali",B,Area Preclinica 2016,prevenzione e deontologia medica
3251,quale dei seguenti vaccini viene somministrato obbligatoriamente in italia a tutti i nuovi nati ?,antiinfluenzale,antiparotite,antipertossico,antiepatite a,nessuna delle risposte indicate,E,Area Preclinica 2016,prevenzione e deontologia medica
3301,il dipartimento di prevenzione (o di sanita' pubblica):,e' una struttura autonoma direttamente gestita dalle regioni che si occupa di tutela della salute collettiva,e' struttura operativa dell'usl che garantisce la tutela della salute collettiva,e' una struttura di rilievo nazionale che si occupa di salute pubblica e protezione dell'ambiente,e' ente senza autonomia organizzativa e contabile che emana ordinanze in materia di igiene e sanita',e' stato abolito dal d.lgs. 502/92 e successive modifiche,B,Area Preclinica 2016,prevenzione e deontologia medica
149,"le seguenti caratteristiche sono proprie dei farmaci ""generici"" tranne:",sono prodotti industrialmente.,sono utili per molteplici patologie in quanto non specifici.,sono bioequivalenti rispetto alla specialità di riferimento.,non sono protetti da brevetto.,sono senza obbligo di prescrizione.,C,Area Preclinica 2017,farmacologia
1779,qual'e' il legamento teso tra il contorno del foro occipitale e l'atlante,la membrana tettoria,il legamento giallo,il legamento dell'apice del dente,il legamento trasverso dell'atlante,la membrana atlanto-occipitale,E,Area Preclinica 2017,morfologia
2490,"la sindrome clinica caratterizzata da diarrea acquosa, ipocaliemia e acloridria è normalmente sostenuta da?",carcinoidi,tumori a cellule delta del pancreas,lipomi,feocromocitomi,gastronomi,B,Area Preclinica 2017,patologia
2551,il tempo di protrombina (pt o tempo di quick) valuta:,la via estrinseca e comune della coagulazione,la via estrinseca della coagulazione,la via intrinseca e comune della coagulazione,la via comune della coagulazione,il numero di piastrine,B,Area Preclinica 2017,patologia
54,quale tra i seguenti termini non viene utilizzato per indicare un disturbo causato da un medicinale in un determinato individuo?,adverse drug reaction.,segnale.,evento avverso.,reazione avversa.,disturbo iatrogeno.,B,Area Preclinica 2019,farmacologia
135,la somministrazione di aminofillina endovena non causa:,vertigini,ipertensione,precordialgia,cefalea,nausea,B,Area Preclinica 2019,farmacologia
177,in quale delle seguenti malattie non si prospetta la terapia genica?,fibrosi cistica,emofilia,ulcera gastrica,tumori,aids,C,Area Preclinica 2019,farmacologia
241,la dose orale di morfina considerata equivalente a 10 mg intramuscolo è:,5 mg,20 mg,30 mg,50 mg,80 mg,C,Area Preclinica 2019,farmacologia
376,qual è il meccanismo d'azione della venlafaxina?,blocco dei recettori d2 e 5ht2,blocco dei recettori &#61537;2 sul terminale noradrenergico e sul neurone serotoninergico,inibizione selettiva della ricaptazione della serotonina,"blocco dei recettori alfa1, h1, m1",inibizione della ricaptazione della serotonina e della noradrenalina,E,Area Preclinica 2019,farmacologia
825,quale delle seguenti situazioni è principalmente responsabile per la quota di estradiolo circolante nell'uomo?,secrezione dalle cellule di leydig,secrezione dalle cellule del sertoli,azione dell'aromatasi sui livelli circolanti degli androgeni,azione dell'aromatasi sui livelli circolanti degli estrogeni,secrezione dallo strato interno (reticularis) della corteccia surrenalica,C,Area Preclinica 2019,fisiologia
1110,quali delle seguenti cellule del pancreas secernono somatostatina:,cellule alfa,cellule acinose,cellule dei dotti,cellule d,cellule beta,D,Area Preclinica 2019,fisiologia
1373,"una ipoalbuminemia selettiva puo' essere dovuta a tutte le seguenti affermazioni, tranne:",ad eccessiva perdita di albumina con le urine o con le feci,ad un carente apporto di materiali sui quali effettuare la sintesi dell'albumina selettiva,ad una alterata sintesi proteica per eccesso di globulinopoiesi,glomerulonefrite,enteropatia essudativa,D,Area Preclinica 2019,fisiologia
1516,la presenza di fischi all'auscultazione del torace e' caratteristica di:,broncostenosi,bronchiectasie,edema interstiziale,edema alveolare,pneumotorace,A,Area Preclinica 2019,fisiologia
1544,gli esami di laboratorio per la valutazione della funzione tiroidea comprendono tutti i seguenti parametri tranne:,dosaggio tsh,dosaggio frazioni libere ft3-ft4,dosaggio anticorpi antitireoglobulina,dosaggio anticorpi antitireoperossidasi,dosaggio fsh,E,Area Preclinica 2019,fisiologia
1831,le cellule pancreatiche secernenti glucagone sono:,cellule alfa,cellule beta,cellule gamma,cellule g,nessuna delle citate,A,Area Preclinica 2019,morfologia
1868,la gametogenesi da ormone lh si osserva:,durante la vita fetale,alla nascita,alla pubertà,ciclicamente dalla nascita alla pubertà,ciclicamente dalla pubertà alla menopausa,E,Area Preclinica 2019,morfologia
2001,"tutte le seguenti funzioni biologiche mediate dal complemento proposte sono corrette,tranne:",induzione di lisi osmotica,generazione di anafilotossine,chemiotassi dei neutrofili,induzione di morte cellulare per apoptosi,opsonizzazione e fagocitosi di microorganismi,D,Area Preclinica 2019,patologia
2142,"quale delle seguenti affermazioni riguardanti il prodotto del gene p53, è corretta?",attiva la trascrizione di enzimi coinvolti nella sintesi degli ormoni steroidei,si trova solo sul cromosoma y,gioca un ruolo fondamentale nell'arresto del ciclo cellulare e nell'apoptosi,e' un oncogene,e' il principale responsabile del linfoma di burkitt,C,Area Preclinica 2019,patologia
2190,quale tipo di immunoglobuline si trova in maggiore concentrazione nel siero di un individuo normale?,igm,igg,ine,iga,igd,B,Area Preclinica 2019,patologia
2421,per memoria immunologica si intende:,attivazione delle cellule fagocitarie che devono ingerire i microrganismi infettanti,cambiamenti che avvengono nelle risposte immunitarie adattative nelle successive esposizioni agli antigeni,reazione costante della risposta immunologia innata ad un particolare microbo,riconoscimento dei profili molecolari associati al patogeno da parte dei recettori di riconoscimento del profilo,stimolare una cellula ospite anomala con un numero ridotto di molecole mhc di classe i a commettere il proprio suicidio,B,Area Preclinica 2019,patologia
2614,la steatosi epatica ha un'aumentata incidenza in tutti queste condizioni tranne:,alcolisti,obesi,pazienti con bypass digiuno-ileali,colecistectomizzati,pazienti in nutrizione parenterale,D,Area Preclinica 2019,patologia
2691,tutte le seguenti caratteristiche della malattia di crohn sono esatte tranne:,l'interessamento intestinale è discontinuo,la flogosi è transmurale,può essere colpito lo stomaco,le fistole sono comuni tranne che in sede anorettale,si formano aderenze fra anse intestinali,D,Area Preclinica 2019,patologia
2900,"in caso di intervento chirurgico su minore, relativamente al consenso informato all'intervento quale delle seguenti affermazioni è vera ? (art.35 del cdm 2014)",è sufficiente il consenso del minore,bisogna tener in considerazione le opinioni del minore in tutti i processi decisionali che lo riguardano ma è necessario il consenso del rappresentante legale,se il rappresentante legale nega il consenso il medico non può intervenire anche in emergenza,in caso di opposizione del legale rappresentante al trattamento necessario il medico non ha più alcun potere di intervenire,in caso di opposizione del legale rappresentante al trattamento necessario il medico non è tenuto ad informare l'autorità giudiziaria,B,Area Preclinica 2019,prevenzione e deontologia medica
